{"arrays":"model-seed-20261025.model.53d68f47bcd0e8f8.npz","arrays_sha256":"53d68f47bcd0e8f80bdf3920eb81cc525cfe00ba0682c211f41e7991123cbbba","classes":["api_interface_modified","dependency_upgraded","compatibility_checked","ci_failed","bug_fixed","integration_test_passed","review_approved","deployed","rolled_back"],"event_catalog":["api_interface_modified","dependency_upgraded","compatibility_checked","ci_failed","bug_fixed","integration_test_passed","review_approved","deployed","rolled_back"],"feature_count":112,"feature_names":["ci_failure_count","count::api_interface_modified","count::bug_fixed","count::ci_failed","count::compatibility_checked","count::dependency_upgraded","count::deployed","count::integration_test_passed","count::review_approved","count::rolled_back","fix_after_failure","has_review_approval","has_successful_test","lag_1=api_interface_modified","lag_1=bug_fixed","lag_1=ci_failed","lag_1=compatibility_checked","lag_1=dependency_upgraded","lag_1=deployed","lag_1=integration_test_passed","lag_1=review_approved","lag_2=<START>","lag_2=api_interface_modified","lag_2=bug_fixed","lag_2=ci_failed","lag_2=compatibility_checked","lag_2=dependency_upgraded","lag_2=deployed","lag_2=integration_test_passed","lag_2=review_approved","lag_3=<START>","lag_3=api_interface_modified","lag_3=bug_fixed","lag_3=ci_failed","lag_3=compatibility_checked","lag_3=dependency_upgraded","lag_3=deployed","lag_3=integration_test_passed","lag_3=review_approved","prefix_length","proportion::api_interface_modified","proportion::bug_fixed","proportion::ci_failed","proportion::compatibility_checked","proportion::dependency_upgraded","proportion::deployed","proportion::integration_test_passed","proportion::review_approved","proportion::rolled_back","recency::bug_fixed","recency::ci_failed","recency::deployed","recency::integration_test_passed","recency::review_approved","seen::bug_fixed","seen::ci_failed","seen::deployed","seen::integration_test_passed","seen::review_approved","transition::api_interface_modified->api_interface_modified","transition::api_interface_modified->bug_fixed","transition::api_interface_modified->ci_failed","transition::api_interface_modified->compatibility_checked","transition::api_interface_modified->dependency_upgraded","transition::api_interface_modified->deployed","transition::api_interface_modified->integration_test_passed","transition::api_interface_modified->review_approved","transition::bug_fixed->bug_fixed","transition::bug_fixed->ci_failed","transition::bug_fixed->compatibility_checked","transition::bug_fixed->deployed","transition::bug_fixed->integration_test_passed","transition::bug_fixed->review_approved","transition::ci_failed->api_interface_modified","transition::ci_failed->bug_fixed","transition::ci_failed->ci_failed","transition::ci_failed->compatibility_checked","transition::ci_failed->dependency_upgraded","transition::ci_failed->deployed","transition::ci_failed->review_approved","transition::compatibility_checked->bug_fixed","transition::compatibility_checked->ci_failed","transition::compatibility_checked->compatibility_checked","transition::compatibility_checked->deployed","transition::compatibility_checked->integration_test_passed","transition::compatibility_checked->review_approved","transition::dependency_upgraded->api_interface_modified","transition::dependency_upgraded->bug_fixed","transition::dependency_upgraded->ci_failed","transition::dependency_upgraded->compatibility_checked","transition::dependency_upgraded->dependency_upgraded","transition::dependency_upgraded->deployed","transition::dependency_upgraded->integration_test_passed","transition::dependency_upgraded->review_approved","transition::deployed->api_interface_modified","transition::deployed->bug_fixed","transition::deployed->ci_failed","transition::deployed->compatibility_checked","transition::deployed->deployed","transition::deployed->review_approved","transition::integration_test_passed->bug_fixed","transition::integration_test_passed->ci_failed","transition::integration_test_passed->compatibility_checked","transition::integration_test_passed->deployed","transition::integration_test_passed->review_approved","transition::review_approved->api_interface_modified","transition::review_approved->bug_fixed","transition::review_approved->ci_failed","transition::review_approved->compatibility_checked","transition::review_approved->deployed","transition::review_approved->integration_test_passed","transition::review_approved->review_approved"],"model_seed":20281025,"provenance":{"config_hash":"83b78d453501c33415d8e834ea3f0d46d66aa44278ae2fb1e1f471f1f12e2b51","final_profile_hash":"75d9435dc2d28a231d3e860abb43689855149a35179c40ab492568d7b11d003d","split_seed":20271025,"training_examples_hash":"4342ed5cb7dfde6fe4f73c896b307c509f09cde04e6c13ce72f2ec158b1415c2"},"python_version":"3.11.9","recency_cap":10,"schema_version":"event-predictor.v2","scikit_learn_version":"1.5.2","selected_c":10.0,"selection_report":[{"c":0.1,"converged":true,"validation_macro_f1":0.31407930471297907},{"c":1.0,"converged":true,"validation_macro_f1":0.3137283688689958},{"c":10.0,"converged":true,"validation_macro_f1":0.3141932907441243}]}
